{
  "changelog": {
    "enabled": true,
    "file": "CHANGELOG.md",
    "includeTypes": ["feat", "fix", "docs"],
    "title": "{{REVOLA_VERSION}} ({{REVOLA_DATE}})"
  },
  "git": {
    "add": true,
    "author": {
      "email": "bot@example.com",
      "name": "revola-bot"
    },
    "cleanWorkingDirectory": true,
    "commit": true,
    "commitMessage": "Release {{REVOLA_VERSION}}",
    "push": true,
    "tag": true,
    "tagAnnotation": "Release {{REVOLA_VERSION}}",
    "tagFormat": "v{{REVOLA_VERSION}}",
    "tagMajor": false,
    "tagMinor": false,
    "targetBranch": "main",
    "upstream": true
  },
  "hooks": {
    "after:publish": ["echo done", "echo cleanup"],
    "before:init": "echo init"
  },
  "jsr": {
    "packageManager": "npx",
    "publish": true,
    "publishArgs": ["--allow-dirty"],
    "tokenRef": "JSR_TOKEN"
  },
  "logLevel": "debug",
  "npm": {
    "access": "public",
    "packageManager": "pnpm",
    "provenance": false,
    "publish": true,
    "registry": "https://registry.npmjs.org/",
    "tag": "latest",
    "tokenRef": "NPM_TOKEN"
  },
  "plugins": {
    "my-plugin": {
      "obj": {},
      "option": true,
      "str": ""
    }
  },
  "preset": "node",
  "version": {
    "defaultBump": "minor",
    "strategy": "semver"
  }
}
